### ISSUE TITLE
otel-collector daemonset crashes on AWS M8i instances - "failed to shutdown the retiring config"

### ISSUE THREAD

**Issue by dwilliams782** [dash0hq/dash0-operator#1107]
I was on the fence whether to write this up here or in the opentelemetry repo, so we can move it / cross-post.

**Describe the bug**
When a Dash0Monitoring CRD is added / removed, the otel-collector daemonset pods get restarted via config reload. We've had sporadic invalid memory address errors during this reload for some time (which is tracked [here](https://github.com/open-telemetry/opentelemetry-collector-contrib/issues/47672)) but is separate to this new issue.

We recently expanded our EKS machine types via Karpenter to allow M8i family machines. Following this, we got spammed with container restarts on the otel-collector daemonset with context deadline exceeded logs:

```
2026-06-10T10:00:06.013Z	info	service@v0.151.0/service.go:292	Shutdown complete.	{"resource": {"k8s.cluster.name": "x", "k8s.cluster.uid": "x", "k8s.container.name": "opentelemetry-collector", "k8s.daemonset.name": "dash0-operator-opentelemetry-collector-agent-daemonset", "k8s.daemonset.uid": "86564bc5-8817-4449-aa52-64d9cf99cbd1", "k8s.namespace.name": "dash0-system", "k8s.node.name": "x", "k8s.pod.name": "dash0-operator-opentelemetry-collector-agent-daemonset-b8m2v", "k8s.pod.uid": "96683afb-df95-4e51-9da6-492b8ec3222b", "service.instance.id": "4fd57850-7aed-45aa-9fa0-d853eb744ebd", "service.name": "dash0-operator-collector", "service.version": "0.151.0"}}
Error: failed to shutdown the retiring config: failed to shutdown logger: context deadline exceeded: rpc error: code = DeadlineExceeded desc = context deadline exceeded
``` 

I reverted the Karpenter change to remove M8i machines, and these ContextDeadlineExceeded errors stopped. 

I then added a new debug Karpenter nodepool of M8i, running a single node - the rest of the cluster is on 7th generation or lower, and during config reloads, only the M8i pod restarts:

```
k get pods | grep agent
dash0-operator-opentelemetry-collector-agent-daemonset-8tsnd      2/2     Running     0               63m
dash0-operator-opentelemetry-collector-agent-daemonset-b8m2v      2/2     Running     5 (5m34s ago)   100m
dash0-operator-opentelemetry-collector-agent-daemonset-h7lpc      2/2     Running     0               88m
dash0-operator-opentelemetry-collector-agent-daemonset-lz58l      2/2     Running     0               4m1s
dash0-operator-opentelemetry-collector-agent-daemonset-pn2t7      2/2     Running     0               40m
dash0-operator-opentelemetry-collector-agent-daemonset-zgzgz      2/2     Running     0               76s
```

I believe this is related to a change in TCP connection behaviour in 8th generation instances:

> Default TCP established timeout for idle TCP connections has been reduced from 432,000 seconds to 350 seconds.

[Source](https://repost.aws/questions/QUxr4F835wS7CcfGy0MSvk2w/silent-websocket-disconnects-on-r8i-r8i-flex-m8i-instances-after-5-minutes-of-inactivity-no-close-error-event-detected)

Trying to prove the above, I ran tcpdump whilst reloading the config (via namespace creation) and observed:

```
Terminal 1 - debug container on node 
kubectl debug node/ip-10-1-3-124.eu-west-2.compute.internal -it --image=nicolaka/netshoot --profile=sysadmin -- sh

tcpdump -ni any -tttt -q 'port 4317 and host ingress.eu-west-1.aws.dash0.com'
...
Endpoint 52.210.74.125:4317 = ingress.eu-west-1.aws.dash0.com. 

Connection A — local port 59833, an 88-byte frame re-sent with doubling backoff:
2026-06-10 09:48:06.290337 enp39s0 Out IP 10.1.3.124.59833 > 52.210.74.125.4317: tcp 88
2026-06-10 09:48:06.740361 enp39s0 Out IP 10.1.3.124.59833 > 52.210.74.125.4317: tcp 88
2026-06-10 09:48:07.690350 enp39s0 Out IP 10.1.3.124.59833 > 52.210.74.125.4317: tcp 88
2026-06-10 09:48:09.530368 enp39s0 Out IP 10.1.3.124.59833 > 52.210.74.125.4317: tcp 88
2026-06-10 09:48:13.130402 enp39s0 Out IP 10.1.3.124.59833 > 52.210.74.125.4317: tcp 88
2026-06-10 09:48:20.490341 enp39s0 Out IP 10.1.3.124.59833 > 52.210.74.125.4317: tcp 88
inter-send gaps: 0.45 → 0.95 → 1.84 → 3.60 → 7.36 s (TCP RTO doubling). No 52.210.74.125.4317 > 10.1.3.124.59833 reply appears anywhere → zero ACKs, no RST.

Connection B — local port 30198, a 49-byte frame, identical pattern:
2026-06-10 09:48:06.320326 enp39s0 Out IP 10.1.3.124.30198 > 52.210.74.125.4317: tcp 49
2026-06-10 09:48:06.770329 enp39s0 Out IP 10.1.3.124.30198 > 52.210.74.125.4317: tcp 49
2026-06-10 09:48:07.700325 enp39s0 Out IP 10.1.3.124.30198 > 52.210.74.125.4317: tcp 49
2026-06-10 09:48:09.530363 enp39s0 Out IP 10.1.3.124.30198 > 52.210.74.125.4317: tcp 49
2026-06-10 09:48:13.130364 enp39s0 Out IP 10.1.3.124.30198 > 52.210.74.125.4317: tcp 49
2026-06-10 09:48:20.490336 enp39s0 Out IP 10.1.3.124.30198 > 52.210.74.125.4317: tcp 49

Contrast — a healthy connection getting replies at the very same instant
 Local ports 41819 / 3634 receive server data + ACKs while A and B are black-holed:
2026-06-10 09:48:06.022988 enp39s0 In IP 52.210.74.125.4317 > 10.1.3.124.3634:  tcp 86
2026-06-10 09:48:06.028317 enp39s0 In IP 52.210.74.125.4317 > 10.1.3.124.41819: tcp 0
2026-06-10 09:48:06.041337 enp39s0 In IP 52.210.74.125.4317 > 10.1.3.124.41819: tcp 89
2026-06-10 09:48:06.053250 enp39s0 In IP 52.210.74.125.4317 > 10.1.3.124.41819: tcp 39
```

Excuse the Claude summary for the TCP dump 😛 

```
Terminal 2 - watching for logs / crashes
k logs dash0-operator-opentelemetry-collector-agent-daemonset-b8m2v
...
2026-06-10T09:48:06.015Z  info  service@v0.151.0/service.go:292  Shutdown complete.
 Error: failed to shutdown the retiring config: failed to shutdown logger: context deadline exceeded: rpc error: code = DeadlineExceeded desc = context deadline exceeded
```

```
Terminal 3 - trigger Dash0Monitoring creation via namespace creation
for i in $(seq 1 8); do
    kubectl create ns m8i-reload-test 2>/dev/null
    sleep 15
    kubectl delete ns m8i-reload-test --wait=false 2>/dev/null
    sleep 15
done

namespace/m8i-reload-test created
namespace "m8i-reload-test" deleted
namespace/m8i-reload-test created
namespace "m8i-reload-test" deleted
namespace/m8i-reload-test created
```

This shows we have some connections that are in a dead state (no responses) and could align with the new 350s TCP timeout, but without idle connection time, it does not *prove* this as a root cause. Just a correlation.

**Environment (please complete the following information):**
 - Cloud Provider: AWS
 - Cloud Provider Kubernetes Offering: AWS EKS 
 - Kubernetes version: v1.33.11-eks-40737a8
 - dash0-operator: 0.137.0

**To Reproduce**

M8i nodepool:

```
---
apiVersion: karpenter.sh/v1
kind: NodePool
metadata:
  name: m8i-debug-node-pool
  namespace: kube-system
spec:
  template:
    metadata:
      labels:
        env: "stg"
        team: "cloud-infrastructure"
        provisioner: "karpenter"
        node-pool: "m8i-debug"
    spec:
      nodeClassRef:
        group: karpenter.k8s.aws
        kind: EC2NodeClass
        name: al2023-default
      taints:
        - key: m8i-debug
          value: "true"
          effect: NoSchedule
      requirements:
        - key: "karpenter.sh/capacity-type"
          operator: In
          values: ["spot", "on-demand"]
        - key: "node.kubernetes.io/instance-type"
          operator: In
          values: ["m8i.large", "m8i-flex.large"]
        - key: "topology.kubernetes.io/zone"
          operator: In
          values:
            - eu-west-2a
            - eu-west-2b
            - eu-west-2c
      expireAfter: 168h
  limits:
    cpu: 2
  disruption:
    consolidationPolicy: WhenEmpty
    consolidateAfter: 1m
```

Schedule a dummy workload to this node to make sure Karpenter keeps it alive, and make sure your otel daemonset is configured to be scheduled with the tolerations. 

Helm values:

```
operator:
  dash0Export:
    enabled: true
    disableSecretValidation: true
    endpoint: ingress.eu-west-1.aws.dash0.com:4317
    apiEndpoint: https://api.eu-west-1.aws.dash0.com
    secretRef:
      name: dash0-authorization-secret
      key: token

  collectors:
    k8s_attributes:
      wait_for_metadata: false
    daemonSetTolerations:
      - key: m8i-debug
        operator: Exists
        effect: NoSchedule

    filelogOffsetSyncStorageVolume:
      name: filelogreceiver-offsets
      hostPath:
        path: /data/dash0-operator/offset-storage
        type: DirectoryOrCreate

  managerContainerResources:
    # gomemlimit should be 80% of memory limit.
    gomemlimit: 307MiB
    limits:
      cpu: 500m
      memory: 384Mi
      ephemeral-storage: 500Mi
    requests:
      cpu: 50m
      memory: 384Mi
      ephemeral-storage: 500Mi

  prometheusCrdSupportEnabled: true

  autoMonitorNamespaces:
    enabled: true
  monitoringTemplate:
    spec:
      instrumentWorkloads:
        mode: none
      logCollection:
        enabled: true
      eventCollection:
        enabled: true
      prometheusScraping:
        enabled: true
      synchronizePersesDashboards: true
      synchronizePrometheusRules: true
```

Once the the M8i node is up and runnning the otel pod, trigger Dash0Monitoring CRD creation / config reload with namespace creation:

```
for i in $(seq 1 8); do
    kubectl create ns m8i-reload-test 2>/dev/null
    sleep 15
    kubectl delete ns m8i-reload-test --wait=false 2>/dev/null
    sleep 15
  done
```

Watch the otel collector pod for crashes.

**Expected behavior**
Shouldn't crash - TCP keepalive should keep connections fresh?

**Comment by p-d0** [comment]
Hi Dan, thanks for the detailed report :+1: We were able to reproduce the issue and there are different ways to address this:

- I've opened a [PR](https://github.com/dash0hq/dash0-operator/pull/1120) that adds  `daemonSetSysctls` and `deploymentSysctls` to the helm chart to allow configuring the TCP keepalives (`net.ipv4.tcp_keepalive_`) as suggested [here](https://aws.amazon.com/blogs/networking-and-content-delivery/best-practices-for-tcp-connection-management-on-ec2/).
  
  This seems to fix the issue but one caveat is that it gets set for all collector pods on all nodes (not just the M8i ones).
   
- The alternative would be to explicitly increase the TCP timeout for the relevant NodeClass: https://karpenter.sh/docs/concepts/nodeclasses/#tcp-established-timeout

**Comment by p-d0** [comment]
closed by #1120
